Career Pathway,Code,Occupation
Agribusiness Systems,25-1041.00,"Agricultural Sciences Teachers, Postsecondary"
Agribusiness Systems,27-4011.00,Audio and Video Equipment Technicians
Agribusiness Systems,13-1021.00,"Buyers and Purchasing Agents, Farm Products"
Agribusiness Systems,25-9021.00,Farm and Home Management Advisors
Agribusiness Systems,13-1074.00,Farm Labor Contractors
Agribusiness Systems,11-3031.02,"Financial Managers, Branch or Department"
Agribusiness Systems,19-1012.00,Food Scientists and Technologists
Agribusiness Systems,27-1024.00,Graphic Designers
Agribusiness Systems,27-3022.00,Reporters and Correspondents
Agribusiness Systems,41-4011.00,"Sales Representatives, Wholesale and Manufacturing, Technical and Scientific Products"
Animal Systems,19-4011.00,Agricultural and Food Science Technicians
Animal Systems,25-1041.00,"Agricultural Sciences Teachers, Postsecondary"
Animal Systems,19-4011.01,Agricultural Technicians
Animal Systems,45-2021.00,Animal Breeders
Animal Systems,19-1011.00,Animal Scientists
Animal Systems,39-2011.00,Animal Trainers
Animal Systems,11-9013.03,Aquacultural Managers
Animal Systems,25-9021.00,Farm and Home Management Advisors
Animal Systems,11-9013.02,Farm and Ranch Managers
Animal Systems,11-9013.00,"Farmers, Ranchers, and Other Agricultural Managers"
Animal Systems,45-2093.00,"Farmworkers, Farm, Ranch, and Aquacultural Animals"
Animal Systems,45-1011.08,First-Line Supervisors of Animal Husbandry and Animal Care Workers
Animal Systems,45-1011.06,First-Line Supervisors of Aquacultural Workers
Animal Systems,45-1011.00,"First-Line Supervisors of Farming, Fishing, and Forestry Workers"
Animal Systems,41-1011.00,First-Line Supervisors of Retail Sales Workers
Animal Systems,19-4011.02,Food Science Technicians
Animal Systems,45-3021.00,Hunters and Trappers
Animal Systems,39-2021.00,Nonfarm Animal Caretakers
Animal Systems,29-1131.00,Veterinarians
Animal Systems,31-9096.00,Veterinary Assistants and Laboratory Animal Caretakers
Animal Systems,29-2056.00,Veterinary Technologists and Technicians
Animal Systems,19-1023.00,Zoologists and Wildlife Biologists
Environmental Service Systems,13-1041.01,Environmental Compliance Inspectors
Environmental Service Systems,17-3025.00,Environmental Engineering Technicians
Environmental Service Systems,17-2081.00,Environmental Engineers
Environmental Service Systems,19-4091.00,"Environmental Science and Protection Technicians, Including Health"
Environmental Service Systems,47-4041.00,Hazardous Materials Removal Workers
Environmental Service Systems,29-9011.00,Occupational Health and Safety Specialists
Environmental Service Systems,29-9012.00,Occupational Health and Safety Technicians
Environmental Service Systems,37-2021.00,Pest Control Workers
Environmental Service Systems,51-9199.01,Recycling and Reclamation Workers
Environmental Service Systems,53-1021.01,Recycling Coordinators
Environmental Service Systems,49-9021.02,Refrigeration Mechanics and Installers
Environmental Service Systems,53-7081.00,Refuse and Recyclable Material Collectors
Environmental Service Systems,51-8031.00,Water and Wastewater Treatment Plant and System Operators
Food Products and Processing Systems,19-4011.00,Agricultural and Food Science Technicians
Food Products and Processing Systems,45-2011.00,Agricultural Inspectors
Food Products and Processing Systems,25-1041.00,"Agricultural Sciences Teachers, Postsecondary"
Food Products and Processing Systems,19-4011.01,Agricultural Technicians
Food Products and Processing Systems,11-9013.03,Aquacultural Managers
Food Products and Processing Systems,51-3021.00,Butchers and Meat Cutters
Food Products and Processing Systems,13-1021.00,"Buyers and Purchasing Agents, Farm Products"
Food Products and Processing Systems,19-4031.00,Chemical Technicians
Food Products and Processing Systems,15-1151.00,Computer User Support Specialists
Food Products and Processing Systems,11-9013.02,Farm and Ranch Managers
Food Products and Processing Systems,11-9013.00,"Farmers, Ranchers, and Other Agricultural Managers"
Food Products and Processing Systems,45-1011.07,First-Line Supervisors of Agricultural Crop and Horticultural Workers
Food Products and Processing Systems,45-1011.06,First-Line Supervisors of Aquacultural Workers
Food Products and Processing Systems,45-1011.00,"First-Line Supervisors of Farming, Fishing, and Forestry Workers"
Food Products and Processing Systems,45-1011.05,First-Line Supervisors of Logging Workers
Food Products and Processing Systems,43-1011.00,First-Line Supervisors of Office and Administrative Support Workers
Food Products and Processing Systems,51-3091.00,"Food and Tobacco Roasting, Baking, and Drying Machine Operators and Tenders"
Food Products and Processing Systems,51-3092.00,Food Batchmakers
Food Products and Processing Systems,51-3093.00,Food Cooking Machine Operators and Tenders
Food Products and Processing Systems,19-4011.02,Food Science Technicians
Food Products and Processing Systems,19-1012.00,Food Scientists and Technologists
Food Products and Processing Systems,45-2041.00,"Graders and Sorters, Agricultural Products"
Food Products and Processing Systems,51-3022.00,"Meat, Poultry, and Fish Cutters and Trimmers"
Food Products and Processing Systems,39-2021.00,Nonfarm Animal Caretakers
Food Products and Processing Systems,43-9071.00,"Office Machine Operators, Except Computer"
Food Products and Processing Systems,37-2021.00,Pest Control Workers
Food Products and Processing Systems,51-3023.00,Slaughterers and Meat Packers
Natural Resources Systems,11-9013.03,Aquacultural Managers
Natural Resources Systems,25-1042.00,"Biological Science Teachers, Postsecondary"
Natural Resources Systems,53-5021.00,"Captains, Mates, and Pilots of Water Vessels"
Natural Resources Systems,17-1021.00,Cartographers and Photogrammetrists
Natural Resources Systems,49-9092.00,Commercial Divers
Natural Resources Systems,19-1031.00,Conservation Scientists
Natural Resources Systems,47-5041.00,Continuous Mining Machine Operators
Natural Resources Systems,53-7011.00,Conveyor Operators and Tenders
Natural Resources Systems,47-5011.00,"Derrick Operators, Oil and Gas"
Natural Resources Systems,47-5021.00,"Earth Drillers, Except Oil and Gas"
Natural Resources Systems,17-3029.00,"Engineering Technicians, Except Drafters, All Other"
Natural Resources Systems,19-4091.00,"Environmental Science and Protection Technicians, Including Health"
Natural Resources Systems,25-1053.00,"Environmental Science Teachers, Postsecondary"
Natural Resources Systems,19-2041.00,"Environmental Scientists and Specialists, Including Health"
Natural Resources Systems,53-7032.00,Excavating and Loading Machine and Dragline Operators
Natural Resources Systems,47-5031.00,"Explosives Workers, Ordnance Handling Experts, and Blasters"
Natural Resources Systems,45-4021.00,Fallers
Natural Resources Systems,45-1011.06,First-Line Supervisors of Aquacultural Workers
Natural Resources Systems,47-1011.00,First-Line Supervisors of Construction Trades and Extraction Workers
Natural Resources Systems,45-1011.00,"First-Line Supervisors of Farming, Fishing, and Forestry Workers"
Natural Resources Systems,33-3031.00,Fish and Game Wardens
Natural Resources Systems,45-3011.00,Fishers and Related Fishing Workers
Natural Resources Systems,19-4093.00,Forest and Conservation Technicians
Natural Resources Systems,45-4011.00,Forest and Conservation Workers
Natural Resources Systems,19-1032.00,Foresters
Natural Resources Systems,53-7071.00,Gas Compressor and Gas Pumping Station Operators
Natural Resources Systems,51-8092.00,Gas Plant Operators
Natural Resources Systems,19-4041.00,Geological and Petroleum Technicians
Natural Resources Systems,19-4041.02,Geological Sample Test Technicians
Natural Resources Systems,19-4041.01,Geophysical Data Technicians
Natural Resources Systems,47-5081.00,Helpers--Extraction Workers
Natural Resources Systems,53-7051.00,Industrial Truck and Tractor Operators
Natural Resources Systems,53-7033.00,"Loading Machine Operators, Underground Mining"
Natural Resources Systems,45-4023.00,Log Graders and Scalers
Natural Resources Systems,45-4022.00,Logging Equipment Operators
Natural Resources Systems,17-3027.00,Mechanical Engineering Technicians
Natural Resources Systems,47-5042.00,Mine Cutting and Channeling Machine Operators
Natural Resources Systems,53-7111.00,Mine Shuttle Car Operators
Natural Resources Systems,11-9121.00,Natural Sciences Managers
Natural Resources Systems,19-1031.03,Park Naturalists
Natural Resources Systems,51-8093.00,"Petroleum Pump System Operators, Refinery Operators, and Gaugers"
Natural Resources Systems,51-8099.00,"Plant and System Operators, All Other"
Natural Resources Systems,19-4099.02,Precision Agriculture Technicians
Natural Resources Systems,53-7072.00,"Pump Operators, Except Wellhead Pumpers"
Natural Resources Systems,19-1031.02,Range Managers
Natural Resources Systems,25-1193.00,"Recreation and Fitness Studies Teachers, Postsecondary"
Natural Resources Systems,39-9032.00,Recreation Workers
Natural Resources Systems,53-7081.00,Refuse and Recyclable Material Collectors
Natural Resources Systems,47-5051.00,"Rock Splitters, Quarry"
Natural Resources Systems,47-5061.00,"Roof Bolters, Mining"
Natural Resources Systems,47-5012.00,"Rotary Drill Operators, Oil and Gas"
Natural Resources Systems,47-5071.00,"Roustabouts, Oil and Gas"
Natural Resources Systems,51-7041.00,"Sawing Machine Setters, Operators, and Tenders, Wood"
Natural Resources Systems,47-5013.00,"Service Unit Operators, Oil, Gas, and Mining"
Natural Resources Systems,53-5021.01,Ship and Boat Captains
Natural Resources Systems,19-1031.01,Soil and Water Conservationists
Natural Resources Systems,53-7121.00,"Tank Car, Truck, and Ship Loaders"
Natural Resources Systems,53-7073.00,Wellhead Pumpers
Natural Resources Systems,19-1023.00,Zoologists and Wildlife Biologists
Plant Systems,19-4011.00,Agricultural and Food Science Technicians
Plant Systems,25-1041.00,"Agricultural Sciences Teachers, Postsecondary"
Plant Systems,19-4011.01,Agricultural Technicians
Plant Systems,19-1011.00,Animal Scientists
Plant Systems,11-9013.03,Aquacultural Managers
Plant Systems,19-1021.00,Biochemists and Biophysicists
Plant Systems,19-3011.00,Economists
Plant Systems,25-9021.00,Farm and Home Management Advisors
Plant Systems,11-9013.02,Farm and Ranch Managers
Plant Systems,49-3041.00,Farm Equipment Mechanics and Service Technicians
Plant Systems,11-9013.00,"Farmers, Ranchers, and Other Agricultural Managers"
Plant Systems,45-2092.02,"Farmworkers and Laborers, Crop"
Plant Systems,45-2092.00,"Farmworkers and Laborers, Crop, Nursery, and Greenhouse"
Plant Systems,45-2093.00,"Farmworkers, Farm, Ranch, and Aquacultural Animals"
Plant Systems,45-1011.07,First-Line Supervisors of Agricultural Crop and Horticultural Workers
Plant Systems,45-1011.08,First-Line Supervisors of Animal Husbandry and Animal Care Workers
Plant Systems,45-1011.06,First-Line Supervisors of Aquacultural Workers
Plant Systems,45-1011.00,"First-Line Supervisors of Farming, Fishing, and Forestry Workers"
Plant Systems,37-1012.00,"First-Line Supervisors of Landscaping, Lawn Service, and Groundskeeping Workers"
Plant Systems,45-1011.05,First-Line Supervisors of Logging Workers
Plant Systems,41-1011.00,First-Line Supervisors of Retail Sales Workers
Plant Systems,27-1023.00,Floral Designers
Plant Systems,19-4011.02,Food Science Technicians
Plant Systems,19-1012.00,Food Scientists and Technologists
Plant Systems,19-1032.00,Foresters
Plant Systems,37-3019.00,"Grounds Maintenance Workers, All Other"
Plant Systems,37-3011.00,Landscaping and Groundskeeping Workers
Plant Systems,11-9013.01,Nursery and Greenhouse Managers
Plant Systems,45-2092.01,Nursery Workers
Plant Systems,37-3012.00,"Pesticide Handlers, Sprayers, and Applicators, Vegetation"
Plant Systems,41-2031.00,Retail Salespersons
Plant Systems,19-1013.00,Soil and Plant Scientists
Plant Systems,19-1031.01,Soil and Water Conservationists
Plant Systems,37-3013.00,Tree Trimmers and Pruners
"Power, Structural and Technical Systems",45-2091.00,Agricultural Equipment Operators
"Power, Structural and Technical Systems",25-1041.00,"Agricultural Sciences Teachers, Postsecondary"
"Power, Structural and Technical Systems",49-3011.00,Aircraft Mechanics and Service Technicians
"Power, Structural and Technical Systems",49-3041.00,Farm Equipment Mechanics and Service Technicians
"Power, Structural and Technical Systems",49-3042.00,"Mobile Heavy Equipment Mechanics, Except Engines"
"Power, Structural and Technical Systems",41-2022.00,Parts Salespersons
